{
  "contract_name": "LivingWaterAI.C8C9.Work8.ProtectedHoldingProtectionInput",
  "contract_version": "C8C9-W8-PHPI-v1.0.1",
  "baseline_id": "C8C9-BL-20260926T1014+0800-W1-5a1038869805a25e",
  "run_id": "w8-run-001",
  "c_work7_asset_framework_result": {
    "contract_name": "LivingWaterAI.C.Work7.AssetFrameworkIntegrationResult",
    "contract_version": "C-W7-v1.2.0",
    "identity": {
      "run_id": "w8-run-001",
      "client_id": "CLIENT-DEMO",
      "portfolio_id": "PORT-DEMO",
      "request_id": "REQ-DEMO-001"
    },
    "work7_snapshot_id": "C-W7-18004d963f0826ffbd871f3233145ffe",
    "parent_work6_snapshot_id": "C-W6-9dbc99d0088bb01c583d263785828a23",
    "status": "READY_FOR_PM_GATE",
    "route": {
      "decision": "PM_CONTRACT_SCHEMA_GATE",
      "reason_codes": []
    },
    "v70_framework_snapshot": {
      "owner_contract": "V70 owns Strategic Risk Budget/S0-B0/Macro math; C Work7 is consumer/adapter only.",
      "run_id": "RUN-DEMO-W1-001",
      "upstream_v70_snapshot_id": "V70-SNAPSHOT-DEMO",
      "snapshot_as_of": "2026-09-23T10:45:00+08:00",
      "strategic_stock_weight": 0.6,
      "strategic_bond_weight": 0.4,
      "tactical_tilt_t": 0.0,
      "stock_tactical_weight": 0.6,
      "bond_tactical_weight": 0.4,
      "v70_original_dry_powder_weight": 0.0,
      "data_quality": "OK",
      "freshness": "FRESH",
      "source_reference_ids": [
        "SRC_V70"
      ]
    },
    "funding_context_snapshot": {
      "value_state": "KNOWN",
      "boundary_contract": "UPSTREAM_FUNDING_CONTEXT_VALIDATE_AND_ROUTE_ONLY_NO_SECOND_FUNDING_DOMAIN_ENGINE",
      "bank_cash_scope": "OUT_OF_SCOPE",
      "base_currency": "TWD",
      "total_new_investment_amount": 1000000.0,
      "contexts": [
        {
          "domain": "TW_LOCAL_BROKER",
          "broker": "TW-BROKER-A",
          "account": "TWLOCAL-001",
          "bucket_new_investment_amount": 300000.0,
          "brokerage_cash_state": {
            "total": 420000.0,
            "available": 350000.0,
            "unsettled": 50000.0,
            "reserved": 20000.0
          },
          "executable_budget": {
            "equity": {
              "amount": 200000.0,
              "cash_basis": "AVAILABLE",
              "source_domain": "TW_LOCAL_BROKER",
              "source_broker": "TW-BROKER-A",
              "source_account": "TWLOCAL-001"
            },
            "bond": {
              "amount": 100000.0,
              "cash_basis": "AVAILABLE",
              "source_domain": "TW_LOCAL_BROKER",
              "source_broker": "TW-BROKER-A",
              "source_account": "TWLOCAL-001"
            }
          },
          "source_reference_ids": []
        },
        {
          "domain": "TW_SUB_BROKERAGE",
          "broker": "TW-BROKER-B",
          "account": "TWSUB-001",
          "bucket_new_investment_amount": 200000.0,
          "brokerage_cash_state": {
            "total": 260000.0,
            "available": 220000.0,
            "unsettled": 30000.0,
            "reserved": 10000.0
          },
          "executable_budget": {
            "equity": {
              "amount": 150000.0,
              "cash_basis": "AVAILABLE",
              "source_domain": "TW_SUB_BROKERAGE",
              "source_broker": "TW-BROKER-B",
              "source_account": "TWSUB-001"
            },
            "bond": {
              "amount": 50000.0,
              "cash_basis": "AVAILABLE",
              "source_domain": "TW_SUB_BROKERAGE",
              "source_broker": "TW-BROKER-B",
              "source_account": "TWSUB-001"
            }
          },
          "source_reference_ids": []
        },
        {
          "domain": "US_BROKER",
          "broker": "US-BROKER-A",
          "account": "US-001",
          "bucket_new_investment_amount": 500000.0,
          "brokerage_cash_state": {
            "total": 620000.0,
            "available": 550000.0,
            "unsettled": 50000.0,
            "reserved": 20000.0
          },
          "executable_budget": {
            "equity": {
              "amount": 350000.0,
              "cash_basis": "AVAILABLE",
              "source_domain": "US_BROKER",
              "source_broker": "US-BROKER-A",
              "source_account": "US-001"
            },
            "bond": {
              "amount": 150000.0,
              "cash_basis": "AVAILABLE",
              "source_domain": "US_BROKER",
              "source_broker": "US-BROKER-A",
              "source_account": "US-001"
            }
          },
          "source_reference_ids": []
        }
      ],
      "source_reference_ids": [],
      "reason": null
    },
    "work6_final_target_reference": {
      "allocation_id": "C-W6-FINAL-97c157148ba5cccf73dfe332",
      "confirmed_at": "2026-09-24T11:45:00+08:00",
      "confirmed_by": "CLIENT-DEMO",
      "source_reference_ids": [
        "SRC_CLIENT"
      ]
    },
    "protected_locked_weights": [
      {
        "instrument_id": "TSM.US",
        "ticker": "TSM",
        "bucket": "STOCK",
        "current_weight": 0.05,
        "final_target_weight": 0.05,
        "drift": 0.0,
        "protected": true,
        "source_reference_ids": [
          "SRC_CLIENT"
        ]
      }
    ],
    "residual_allocation": {
      "method": "LOCKED_FIRST_THEN_PROPORTIONAL_RESIDUAL_WITHIN_V70_BUCKET",
      "buckets": [
        {
          "bucket": "STOCK",
          "target_weight": 0.6,
          "work6_final_target_bucket_weight": 0.6,
          "locked_weight": 0.05,
          "residual_budget": 0.5499999999999999,
          "unlocked_reference_weight": 0.5499999999999999,
          "allocated_residual_weight": 0.5499999999999999,
          "items": [
            {
              "instrument_id": "0050.TW",
              "ticker": "0050",
              "asset_type": "股票ETF",
              "bucket": "STOCK",
              "protected": false,
              "work6_final_target_weight": 0.5499999999999999,
              "integrated_weight": 0.5499999999999999,
              "allocation_rule": "PROPORTIONAL_RESIDUAL_FROM_CONFIRMED_FINAL_TARGET",
              "source_reference_ids": [
                "SRC_CLIENT"
              ]
            },
            {
              "instrument_id": "TSM.US",
              "ticker": "TSM",
              "asset_type": "個別公司股票",
              "bucket": "STOCK",
              "protected": true,
              "work6_final_target_weight": 0.05,
              "integrated_weight": 0.05,
              "allocation_rule": "LOCKED_CURRENT_WEIGHT",
              "source_reference_ids": [
                "SRC_CLIENT"
              ]
            }
          ]
        },
        {
          "bucket": "BOND",
          "target_weight": 0.4,
          "work6_final_target_bucket_weight": 0.4,
          "locked_weight": 0,
          "residual_budget": 0.4,
          "unlocked_reference_weight": 0.4,
          "allocated_residual_weight": 0.4,
          "items": [
            {
              "instrument_id": "SGOV.US",
              "ticker": "SGOV",
              "asset_type": "債券ETF",
              "bucket": "BOND",
              "protected": false,
              "work6_final_target_weight": 0.4,
              "integrated_weight": 0.4,
              "allocation_rule": "PROPORTIONAL_RESIDUAL_FROM_CONFIRMED_FINAL_TARGET",
              "source_reference_ids": [
                "SRC_CLIENT"
              ]
            }
          ]
        },
        {
          "bucket": "V70_ORIGINAL_DRY_POWDER",
          "target_weight": 0.0,
          "work6_final_target_bucket_weight": 0.0,
          "locked_weight": 0,
          "residual_budget": 0.0,
          "unlocked_reference_weight": 0,
          "allocated_residual_weight": 0.0,
          "items": []
        }
      ]
    },
    "integrated_asset_framework": {
      "value_state": "KNOWN",
      "stock_weight": 0.6,
      "bond_weight": 0.4,
      "v70_original_dry_powder_weight": 0.0,
      "total_weight": 1.0,
      "instrument_targets": [
        {
          "instrument_id": "0050.TW",
          "ticker": "0050",
          "asset_type": "股票ETF",
          "bucket": "STOCK",
          "protected": false,
          "work6_final_target_weight": 0.5499999999999999,
          "integrated_weight": 0.5499999999999999,
          "allocation_rule": "PROPORTIONAL_RESIDUAL_FROM_CONFIRMED_FINAL_TARGET",
          "source_reference_ids": [
            "SRC_CLIENT"
          ]
        },
        {
          "instrument_id": "TSM.US",
          "ticker": "TSM",
          "asset_type": "個別公司股票",
          "bucket": "STOCK",
          "protected": true,
          "work6_final_target_weight": 0.05,
          "integrated_weight": 0.05,
          "allocation_rule": "LOCKED_CURRENT_WEIGHT",
          "source_reference_ids": [
            "SRC_CLIENT"
          ]
        },
        {
          "instrument_id": "SGOV.US",
          "ticker": "SGOV",
          "asset_type": "債券ETF",
          "bucket": "BOND",
          "protected": false,
          "work6_final_target_weight": 0.4,
          "integrated_weight": 0.4,
          "allocation_rule": "PROPORTIONAL_RESIDUAL_FROM_CONFIRMED_FINAL_TARGET",
          "source_reference_ids": [
            "SRC_CLIENT"
          ]
        }
      ],
      "work6_final_target_preserved": true,
      "reason": null
    },
    "drift_snapshot": {
      "value_state": "KNOWN",
      "as_of": "2026-09-24T11:45:00+08:00",
      "denominator": {
        "value_state": "KNOWN",
        "amount": 1000000.0,
        "currency": "TWD",
        "as_of": "2026-09-24T11:45:00+08:00",
        "data_quality": "OK",
        "freshness": "FRESH",
        "issue_codes": [],
        "source_reference_ids": [
          "SRC_CLIENT"
        ]
      },
      "items": [
        {
          "instrument_id": "0050.TW",
          "ticker": "0050",
          "current_weight": {
            "value_state": "KNOWN",
            "value": 0.55
          },
          "final_target_weight": {
            "value_state": "KNOWN",